{
  "schema_version": "0.1.0",
  "run_id": "hcx_real_smoke_00000000000000000000000000000000",
  "created_at": "2026-09-02T00:00:00.000Z",
  "provider_id": "hcx",
  "model_id": null,
  "endpoint_hostname": null,
  "endpoint_https": null,
  "api_key_env_var_name": "HCX_API_KEY",
  "api_key_present": false,
  "request_schema_version": "hcx-chat-completions-v3",
  "response_schema_version": "hcx-chat-completions-v3",
  "max_output_tokens": 256,
  "temperature": 0.3,
  "top_p": 0.8,
  "seed_supported": false,
  "request_timeout_ms": 15000,
  "retry_max_attempts": 2,
  "maximum_requests": 10,
  "concurrency": 1,
  "overall_time_budget_ms": 300000,
  "cost_configured": false,
  "actual_external_call_authorized": false,
  "ready": false,
  "missing_config": ["HCX_API_KEY", "HCX_ENDPOINT_URL", "HCX_MODEL_ID"]
}
