{
  "schema_version": "0.1.0",
  "run_id": "hcx_real_smoke_cffcde8ed8d04ff5aaef9deee3cca3c3",
  "created_at": "2026-09-01T23:03:49.052Z",
  "provider_id": "hcx",
  "model_id": "HCX-005",
  "endpoint_hostname": "clovastudio.stream.ntruss.com",
  "endpoint_https": true,
  "api_key_env_var_name": "HCX_API_KEY",
  "api_key_present": true,
  "request_schema_version": "hcx-chat-completions-v3",
  "response_schema_version": "hcx-chat-completions-v3",
  "max_output_tokens": 256,
  "temperature": 0.3,
  "top_p": 0.8,
  "seed_supported": false,
  "request_timeout_ms": 15000,
  "retry_max_attempts": 2,
  "maximum_requests": 10,
  "concurrency": 1,
  "overall_time_budget_ms": 300000,
  "cost_configured": false,
  "actual_external_call_authorized": true,
  "ready": true,
  "missing_config": []
}
